{"contract":"reasoning-distiller-invocation/1","created_at":"2026-08-20T18:49:44-07:00","evidence":[{"digest":"sha256:e9df851387f8f9a54c2ea68126a042e5cce6cea8a1e33ceeb1ae0f8fcacffc2a","locator":"runtime/ril_activation.py","source_id":"src:file:c418de22f065bbb07631297d","type":"repository_file"},{"digest":"sha256:f154d81ee8f1f3856b0285ba2a1fb49ab5d128e8e626b15d23f819e7ccc276d1","locator":"runtime/ril_admission.py","source_id":"src:file:85604f1dde3d3bc0d9b42c0a","type":"repository_file"},{"digest":"sha256:310cc598d15c71c05e4f1713045bf08535c5ebc95337920789eeff4e1d846b8d","locator":"runtime/ril_authority_grant.py","source_id":"src:file:fe1fe1f089ea5786cb7cdc22","type":"repository_file"},{"digest":"sha256:b3bb66dc77ef04de7260245352802efa7ddaaa027ec464cab8bf950759c4edec","locator":"runtime/ril_cli.py","source_id":"src:file:8ba17a1ce63d654009342ef5","type":"repository_file"},{"digest":"sha256:6e63d3b7d476e74aa020f6198e3d2d636d3e2350f80ab84c12f4fb50952cb086","locator":"runtime/ril_governance.py","source_id":"src:file:f2efb3d1877a2242c2389fbf","type":"repository_file"},{"digest":"sha256:ec6145bce9d1c051ef1177e3754a4ccbf55819182483a52c710697ba5bb880e1","locator":"runtime/ril_grant_operations.py","source_id":"src:file:0584fa93592038469a41665d","type":"repository_file"},{"digest":"sha256:a577cfca22e2be767a4ab4d7667084b83278a7015426c3b3b05da3d287128032","locator":"runtime/ril_human_agent.py","source_id":"src:file:2ab4da359b50657749369d8c","type":"repository_file"},{"digest":"sha256:5a7aa08424f678abfc180ca47515e3456af2f66dd06a4db408023a33d7fccdcd","locator":"runtime/ril_human_confirmation.py","source_id":"src:file:42ce1432b7372b7268b0784b","type":"repository_file"},{"digest":"sha256:c6c1bf64d9ea5aea6133ce9f9f9d23de15dfbfba3ba7e7ccbffe3d3730ecaa1d","locator":"runtime/ril_mutation.py","source_id":"src:file:a54fe86be9fd9b1299bf72fc","type":"repository_file"},{"digest":"sha256:84ec04ac149a3bc56d081e53d653d6f715a0b671a7f595bcc56c2e12c634b335","locator":"runtime/ril_operator_management.py","source_id":"src:file:cff9fd6abfa2ae7782ce75f7","type":"repository_file"},{"digest":"sha256:4ad0c29e01f4c23624ef01f84f3cfa2fd6af783a3ba8c50310c12113f987715b","locator":"runtime/ril_operators.py","source_id":"src:file:03ed82720a688f74105875e5","type":"repository_file"},{"digest":"sha256:2843eeeff28ee97264280efffe629e2c883c8d99202803468e227c93ca04df08","locator":"runtime/ril_orchestrator.py","source_id":"src:file:1d4f0e9dd88c4e66f4770aff","type":"repository_file"},{"digest":"sha256:a777d48c3c935171ab41da0fdb3c8bacca58a8199643eb6004c1d2c7ef231e2c","locator":"runtime/ril_reconciliation.py","source_id":"src:file:dbcbe7d4342f75c61f8290f8","type":"repository_file"},{"digest":"sha256:61120289fdbf5182a4671e7f749631dadc52e25ed8d2817a11d3bbc4b8c2294b","locator":"runtime/ril_recovery.py","source_id":"src:file:2b16462be75fd699d8d1526b","type":"repository_file"},{"digest":"sha256:2cb2ef8ccd88e9eb51fed5bd9b1210efbc7a3e3c98601291476a172745693c28","locator":"runtime/ril_repair.py","source_id":"src:file:70ae51efb7bb01ca6badebc4","type":"repository_file"},{"digest":"sha256:28fc092b92f56ff88e2c3eb72f16f29d50ecf1bcb040e2411c14a30f8a2ccdf2","locator":"runtime/ril_roles.py","source_id":"src:file:ea47294ded6006a36cca2954","type":"repository_file"},{"digest":"sha256:ab27738297115b202471558dbd12b6d2ad96388779137abbe9fd6d9697e764db","locator":"runtime/ril_shared_orchestration.py","source_id":"src:file:6fc2154fc5b08c3cd25467f7","type":"repository_file"},{"digest":"sha256:675086f46d462cf0c14089329648d23a59d51c1f84fe1a42dae93c878c020283","locator":"runtime/ril_status.py","source_id":"src:file:7cbe2ff590fe9cc22ad2170d","type":"repository_file"},{"digest":"sha256:2b2c7184537274d294ceac4026fa8e1ceba51a78f5ce480a3e5d3f5a73880728","locator":"runtime/ril_steward_authorization.py","source_id":"src:file:eb6621acc10790bbfe2ecd83","type":"repository_file"},{"digest":"sha256:0521250c0e9b60940e611544ba152a44059f079aa039796b4c4685d388d1cd4e","locator":"runtime/ril_storage_verification.py","source_id":"src:file:86c759712741255fa5099546","type":"repository_file"},{"digest":"sha256:7db8c8fc90794f898a713aeb2f2cd7839f44d98bef00bbb6bbf27c9f45cc89eb","locator":"runtime/ril_workflow.py","source_id":"src:file:3b96fd37fefb1898b1b27e4f","type":"repository_file"}],"invocation_id":"repository-wide-v1-05-runtime-ril-20260820","output":{"raw_candidate_path":"project-knowledge/invocations/repository-wide-v1-05-runtime-ril-20260820.raw.json","submission_path":"project-knowledge/submissions/repository-wide-v1-05-runtime-ril-20260820.json"},"project_root":".","source_context":{"refs":["repository:8ce7e745f017d20ef90af043519c7379736dbc9d","partition:05-runtime-ril","scan:repository-wide-v1"],"summary":"First comprehensive repository distillation partition 05-runtime-ril; fixed repository snapshot 8ce7e745f017d20ef90af043519c7379736dbc9d."},"source_registry":[{"digest":"sha256:e9df851387f8f9a54c2ea68126a042e5cce6cea8a1e33ceeb1ae0f8fcacffc2a","locator":"runtime/ril_activation.py","source_id":"src:file:c418de22f065bbb07631297d","type":"repository_file"},{"digest":"sha256:f154d81ee8f1f3856b0285ba2a1fb49ab5d128e8e626b15d23f819e7ccc276d1","locator":"runtime/ril_admission.py","source_id":"src:file:85604f1dde3d3bc0d9b42c0a","type":"repository_file"},{"digest":"sha256:310cc598d15c71c05e4f1713045bf08535c5ebc95337920789eeff4e1d846b8d","locator":"runtime/ril_authority_grant.py","source_id":"src:file:fe1fe1f089ea5786cb7cdc22","type":"repository_file"},{"digest":"sha256:b3bb66dc77ef04de7260245352802efa7ddaaa027ec464cab8bf950759c4edec","locator":"runtime/ril_cli.py","source_id":"src:file:8ba17a1ce63d654009342ef5","type":"repository_file"},{"digest":"sha256:6e63d3b7d476e74aa020f6198e3d2d636d3e2350f80ab84c12f4fb50952cb086","locator":"runtime/ril_governance.py","source_id":"src:file:f2efb3d1877a2242c2389fbf","type":"repository_file"},{"digest":"sha256:ec6145bce9d1c051ef1177e3754a4ccbf55819182483a52c710697ba5bb880e1","locator":"runtime/ril_grant_operations.py","source_id":"src:file:0584fa93592038469a41665d","type":"repository_file"},{"digest":"sha256:a577cfca22e2be767a4ab4d7667084b83278a7015426c3b3b05da3d287128032","locator":"runtime/ril_human_agent.py","source_id":"src:file:2ab4da359b50657749369d8c","type":"repository_file"},{"digest":"sha256:5a7aa08424f678abfc180ca47515e3456af2f66dd06a4db408023a33d7fccdcd","locator":"runtime/ril_human_confirmation.py","source_id":"src:file:42ce1432b7372b7268b0784b","type":"repository_file"},{"digest":"sha256:c6c1bf64d9ea5aea6133ce9f9f9d23de15dfbfba3ba7e7ccbffe3d3730ecaa1d","locator":"runtime/ril_mutation.py","source_id":"src:file:a54fe86be9fd9b1299bf72fc","type":"repository_file"},{"digest":"sha256:84ec04ac149a3bc56d081e53d653d6f715a0b671a7f595bcc56c2e12c634b335","locator":"runtime/ril_operator_management.py","source_id":"src:file:cff9fd6abfa2ae7782ce75f7","type":"repository_file"},{"digest":"sha256:4ad0c29e01f4c23624ef01f84f3cfa2fd6af783a3ba8c50310c12113f987715b","locator":"runtime/ril_operators.py","source_id":"src:file:03ed82720a688f74105875e5","type":"repository_file"},{"digest":"sha256:2843eeeff28ee97264280efffe629e2c883c8d99202803468e227c93ca04df08","locator":"runtime/ril_orchestrator.py","source_id":"src:file:1d4f0e9dd88c4e66f4770aff","type":"repository_file"},{"digest":"sha256:a777d48c3c935171ab41da0fdb3c8bacca58a8199643eb6004c1d2c7ef231e2c","locator":"runtime/ril_reconciliation.py","source_id":"src:file:dbcbe7d4342f75c61f8290f8","type":"repository_file"},{"digest":"sha256:61120289fdbf5182a4671e7f749631dadc52e25ed8d2817a11d3bbc4b8c2294b","locator":"runtime/ril_recovery.py","source_id":"src:file:2b16462be75fd699d8d1526b","type":"repository_file"},{"digest":"sha256:2cb2ef8ccd88e9eb51fed5bd9b1210efbc7a3e3c98601291476a172745693c28","locator":"runtime/ril_repair.py","source_id":"src:file:70ae51efb7bb01ca6badebc4","type":"repository_file"},{"digest":"sha256:28fc092b92f56ff88e2c3eb72f16f29d50ecf1bcb040e2411c14a30f8a2ccdf2","locator":"runtime/ril_roles.py","source_id":"src:file:ea47294ded6006a36cca2954","type":"repository_file"},{"digest":"sha256:ab27738297115b202471558dbd12b6d2ad96388779137abbe9fd6d9697e764db","locator":"runtime/ril_shared_orchestration.py","source_id":"src:file:6fc2154fc5b08c3cd25467f7","type":"repository_file"},{"digest":"sha256:675086f46d462cf0c14089329648d23a59d51c1f84fe1a42dae93c878c020283","locator":"runtime/ril_status.py","source_id":"src:file:7cbe2ff590fe9cc22ad2170d","type":"repository_file"},{"digest":"sha256:2b2c7184537274d294ceac4026fa8e1ceba51a78f5ce480a3e5d3f5a73880728","locator":"runtime/ril_steward_authorization.py","source_id":"src:file:eb6621acc10790bbfe2ecd83","type":"repository_file"},{"digest":"sha256:0521250c0e9b60940e611544ba152a44059f079aa039796b4c4685d388d1cd4e","locator":"runtime/ril_storage_verification.py","source_id":"src:file:86c759712741255fa5099546","type":"repository_file"},{"digest":"sha256:7db8c8fc90794f898a713aeb2f2cd7839f44d98bef00bbb6bbf27c9f45cc89eb","locator":"runtime/ril_workflow.py","source_id":"src:file:3b96fd37fefb1898b1b27e4f","type":"repository_file"}]}
