{"contract":"reasoning-distiller-invocation/1","created_at":"2026-08-20T18:49:44-07:00","evidence":[{"digest":"sha256:a10c0dddd4d9ca29f17b8bb1d6a8be3587a45bd55320a5fc6bf8cb98be22f63d","locator":"runtime/rd_bootstrap.py","source_id":"src:file:36f0e3c09bd26ea8ae5faa6f","type":"repository_file"},{"digest":"sha256:075e148a38c29de91e71a952bc3fa15eae3bcb67caca968fcd61e39f958d014b","locator":"runtime/rd_distill.py","source_id":"src:file:a50d74531e346107f9fe74aa","type":"repository_file"},{"digest":"sha256:956e599403de690c30aca253d77d7b2c01b719cbd7f9e5a4d58ab04ed3b2a16c","locator":"runtime/rd_distill_core.py","source_id":"src:file:74e666e6b948e7ad2f612729","type":"repository_file"},{"digest":"sha256:0bf97fd364c97617eb24ee0ff607df67fb4d01364bf1d8b7791ebd51609af191","locator":"runtime/rd_install_recovery.py","source_id":"src:file:19c7ef7ed21ea4cafbcd2d9a","type":"repository_file"},{"digest":"sha256:2ca225002b00891716059176ffe9fd76e0570c67bba1568d05d942bae8c69bab","locator":"runtime/rd_steward_setup.py","source_id":"src:file:d3d8728075b78efe16e77f6f","type":"repository_file"},{"digest":"sha256:4969c62793dbf82fc18dfb031081a30dc48ddb2b4e10e2f7265ba2abdc7ec5eb","locator":"runtime/rupi.py","source_id":"src:file:ecac24605c06e788ccfaee7d","type":"repository_file"},{"digest":"sha256:815b37a0355c9a6ca46990b82be7f6173147e6194ea30f501dacc67496e22c37","locator":"runtime/rupi_authority.py","source_id":"src:file:9f3d677cdab1cd9dffeaaedd","type":"repository_file"},{"digest":"sha256:5e44ac4b617dc8d0d687f948af305f2a4a8832e429d5f0bfec4da78a09fd70dc","locator":"runtime/rupi_lifecycle.py","source_id":"src:file:d97ad49f50097e7a6e7501ce","type":"repository_file"},{"digest":"sha256:1f7e367c1d964d43e690a1b1794315ec2ae168373ef3ec225b88f5a3942d2744","locator":"runtime/rupi_primitive_map.py","source_id":"src:file:f8b10924e8389dc87ddae254","type":"repository_file"}],"invocation_id":"repository-wide-v1-06-runtime-other-20260820","output":{"raw_candidate_path":"project-knowledge/invocations/repository-wide-v1-06-runtime-other-20260820.raw.json","submission_path":"project-knowledge/submissions/repository-wide-v1-06-runtime-other-20260820.json"},"project_root":".","source_context":{"refs":["repository:8ce7e745f017d20ef90af043519c7379736dbc9d","partition:06-runtime-other","scan:repository-wide-v1"],"summary":"First comprehensive repository distillation partition 06-runtime-other; fixed repository snapshot 8ce7e745f017d20ef90af043519c7379736dbc9d."},"source_registry":[{"digest":"sha256:a10c0dddd4d9ca29f17b8bb1d6a8be3587a45bd55320a5fc6bf8cb98be22f63d","locator":"runtime/rd_bootstrap.py","source_id":"src:file:36f0e3c09bd26ea8ae5faa6f","type":"repository_file"},{"digest":"sha256:075e148a38c29de91e71a952bc3fa15eae3bcb67caca968fcd61e39f958d014b","locator":"runtime/rd_distill.py","source_id":"src:file:a50d74531e346107f9fe74aa","type":"repository_file"},{"digest":"sha256:956e599403de690c30aca253d77d7b2c01b719cbd7f9e5a4d58ab04ed3b2a16c","locator":"runtime/rd_distill_core.py","source_id":"src:file:74e666e6b948e7ad2f612729","type":"repository_file"},{"digest":"sha256:0bf97fd364c97617eb24ee0ff607df67fb4d01364bf1d8b7791ebd51609af191","locator":"runtime/rd_install_recovery.py","source_id":"src:file:19c7ef7ed21ea4cafbcd2d9a","type":"repository_file"},{"digest":"sha256:2ca225002b00891716059176ffe9fd76e0570c67bba1568d05d942bae8c69bab","locator":"runtime/rd_steward_setup.py","source_id":"src:file:d3d8728075b78efe16e77f6f","type":"repository_file"},{"digest":"sha256:4969c62793dbf82fc18dfb031081a30dc48ddb2b4e10e2f7265ba2abdc7ec5eb","locator":"runtime/rupi.py","source_id":"src:file:ecac24605c06e788ccfaee7d","type":"repository_file"},{"digest":"sha256:815b37a0355c9a6ca46990b82be7f6173147e6194ea30f501dacc67496e22c37","locator":"runtime/rupi_authority.py","source_id":"src:file:9f3d677cdab1cd9dffeaaedd","type":"repository_file"},{"digest":"sha256:5e44ac4b617dc8d0d687f948af305f2a4a8832e429d5f0bfec4da78a09fd70dc","locator":"runtime/rupi_lifecycle.py","source_id":"src:file:d97ad49f50097e7a6e7501ce","type":"repository_file"},{"digest":"sha256:1f7e367c1d964d43e690a1b1794315ec2ae168373ef3ec225b88f5a3942d2744","locator":"runtime/rupi_primitive_map.py","source_id":"src:file:f8b10924e8389dc87ddae254","type":"repository_file"}]}
