{"contract":"reasoning-distiller-invocation/1","created_at":"2026-08-20T11:47:00-07:00","evidence":[{"digest":"sha256:db2ed9e410c5227158ef3c1d61f829e15477fd1e4a5d1ce088181129da9ad457","locator":".github/workflows/promote-release-source.yml","source_id":"src:file:570a3eee714dbaf3f9e59f7e","type":"repository_file"},{"digest":"sha256:edf50372ae57fce6c54626a1b2cc337ae86ed374ceb1cca819e19763cc0b4bae","locator":".github/workflows/release-source-guard.yml","source_id":"src:file:c157d4bf1469aed738f6f55d","type":"repository_file"},{"digest":"sha256:51c23c528d414e19441669b61cf4767839a40db699bcbcc7bf8810df6bd3ebde","locator":"docs/design/RIL_CLI_DESIGN_CONTRACT.md","source_id":"src:governed:71d9162352d8107132c1f937","type":"governed_artifact"},{"digest":"sha256:f102645b8a6a341f95de7131197c3204f775bd3cace9a4d24ff7ad12bcba082d","locator":"docs/design/RIL_HUMAN_AGENT_DESIGN_CONTRACT.md","source_id":"src:governed:77bdea8cdeb6f95186b56b60","type":"governed_artifact"},{"digest":"sha256:3873730f9667931e989d2f2225a12c13f811d0f4369de2dfccd32b77fb13bb88","locator":"docs/design/RIL_R16_R18_IMPLEMENTATION_CONFORMANCE_PLAN.md","source_id":"src:file:e556c36f56c6ce518fe49b23","type":"repository_file"},{"digest":"sha256:4a6518ab6e1e692207adea1a1238419437ecdca378a0d5a58e2816ad5f584dd2","locator":"docs/design/RIL_WORKFLOW_DESIGN_CONTRACT.md","source_id":"src:governed:27e07171f4b52ff7c98a0c7f","type":"governed_artifact"},{"digest":"sha256:d341e8963b331dc0c0acf6bf8067a132151043c725638a3fb122513f1bb9c4f2","locator":"docs/packaging/INSTALLER_RUNNER_CONTRACT.md","source_id":"src:governed:db91826a5f0edf7f223e95d2","type":"governed_artifact"},{"digest":"sha256:7d4a4ab7f6985ad8b884ac49854598d257affa2bb51a85f19f8881b59ae10f2e","locator":"docs/packaging/INSTALL_PACKAGE_CONTRACT.md","source_id":"src:governed:1fba971e51c885f07559dd4d","type":"governed_artifact"}],"invocation_id":"first-normative-baseline-v2-20260820","output":{"raw_candidate_path":"project-knowledge/invocations/first-normative-baseline-v2-20260820.raw.json","submission_path":"project-knowledge/submissions/first-normative-baseline-v2-20260820.json"},"project_root":".","source_context":{"refs":["baseline:first-distillation:v2","review:approved-corrections-1-8"],"summary":"Reviewed normative baseline v2 for Reasoning Distiller"},"source_registry":[{"digest":"sha256:db2ed9e410c5227158ef3c1d61f829e15477fd1e4a5d1ce088181129da9ad457","locator":".github/workflows/promote-release-source.yml","source_id":"src:file:570a3eee714dbaf3f9e59f7e","type":"repository_file"},{"digest":"sha256:edf50372ae57fce6c54626a1b2cc337ae86ed374ceb1cca819e19763cc0b4bae","locator":".github/workflows/release-source-guard.yml","source_id":"src:file:c157d4bf1469aed738f6f55d","type":"repository_file"},{"digest":"sha256:51c23c528d414e19441669b61cf4767839a40db699bcbcc7bf8810df6bd3ebde","locator":"docs/design/RIL_CLI_DESIGN_CONTRACT.md","source_id":"src:governed:71d9162352d8107132c1f937","type":"governed_artifact"},{"digest":"sha256:f102645b8a6a341f95de7131197c3204f775bd3cace9a4d24ff7ad12bcba082d","locator":"docs/design/RIL_HUMAN_AGENT_DESIGN_CONTRACT.md","source_id":"src:governed:77bdea8cdeb6f95186b56b60","type":"governed_artifact"},{"digest":"sha256:3873730f9667931e989d2f2225a12c13f811d0f4369de2dfccd32b77fb13bb88","locator":"docs/design/RIL_R16_R18_IMPLEMENTATION_CONFORMANCE_PLAN.md","source_id":"src:file:e556c36f56c6ce518fe49b23","type":"repository_file"},{"digest":"sha256:4a6518ab6e1e692207adea1a1238419437ecdca378a0d5a58e2816ad5f584dd2","locator":"docs/design/RIL_WORKFLOW_DESIGN_CONTRACT.md","source_id":"src:governed:27e07171f4b52ff7c98a0c7f","type":"governed_artifact"},{"digest":"sha256:d341e8963b331dc0c0acf6bf8067a132151043c725638a3fb122513f1bb9c4f2","locator":"docs/packaging/INSTALLER_RUNNER_CONTRACT.md","source_id":"src:governed:db91826a5f0edf7f223e95d2","type":"governed_artifact"},{"digest":"sha256:7d4a4ab7f6985ad8b884ac49854598d257affa2bb51a85f19f8881b59ae10f2e","locator":"docs/packaging/INSTALL_PACKAGE_CONTRACT.md","source_id":"src:governed:1fba971e51c885f07559dd4d","type":"governed_artifact"}]}
