{"contract":"reasoning-distiller-invocation/1","created_at":"2026-08-20T18:49:44-07:00","evidence":[{"digest":"sha256:7a25162999213b953b39c89c2897f184bde732b250165da5131e6ceb8d68ca0d","locator":"docs/packaging/CURRENT_RELEASE_STATUS.json","source_id":"src:file:ebec2bc24e2262a606a6740e","type":"repository_file"},{"digest":"sha256:d341e8963b331dc0c0acf6bf8067a132151043c725638a3fb122513f1bb9c4f2","locator":"docs/packaging/INSTALLER_RUNNER_CONTRACT.md","source_id":"src:governed:db91826a5f0edf7f223e95d2","type":"governed_artifact"},{"digest":"sha256:7d4a4ab7f6985ad8b884ac49854598d257affa2bb51a85f19f8881b59ae10f2e","locator":"docs/packaging/INSTALL_PACKAGE_CONTRACT.md","source_id":"src:governed:1fba971e51c885f07559dd4d","type":"governed_artifact"},{"digest":"sha256:f24422e6abcf14b131545e4459ca31b468cd075ba9d913c412e33af2e38a5c24","locator":"docs/packaging/P1_DETERMINISTIC_INSTALLER_AMENDMENT.md","source_id":"src:file:310fadfa923e9f953b0f3bb0","type":"repository_file"},{"digest":"sha256:6cc8e9f979bf19f98e0e4a20f6c808b0727d961de2d09f4661c1a2934c3de75e","locator":"docs/packaging/P2_DETERMINISTIC_BUILDER.md","source_id":"src:file:d329db5ffdd538903f907dd8","type":"repository_file"},{"digest":"sha256:20e80a5869444c8b4f204993beda29e6e8bde3011a2ea430cc8d8355bc4e3c22","locator":"docs/packaging/P3_DETERMINISTIC_INSTALLER.md","source_id":"src:file:eada58fbbaf5254da03b8202","type":"repository_file"},{"digest":"sha256:d1485fec6b54676716a575d3b36d6c1e5560f6b017078456bb9e66d3bafb8895","locator":"docs/packaging/P4_JOURNALED_RECOVERY.md","source_id":"src:file:819ef41273a8c7b6eeb9a697","type":"repository_file"},{"digest":"sha256:a3c5cc4aaa76c74891f6fd41eda6e54752267608925851e2ec3b591147f8dd6f","locator":"docs/packaging/P5_RUNTIME_ISOLATION.md","source_id":"src:file:81ba86e43ea6a5eba2d6832d","type":"repository_file"},{"digest":"sha256:d72f8be27bb033bf934643a9f5fbde11898d50e6b34ce220e38329a1b96cecb9","locator":"docs/packaging/P5_RUNTIME_ISOLATION_STATUS.json","source_id":"src:file:d97bec4f39fa27335bc4a5be","type":"repository_file"},{"digest":"sha256:0d64f35bd3a41d1d8180640759986e416aa986a6445656959661a78e04d4bd75","locator":"docs/packaging/P6_CONSUMER_MIGRATION.md","source_id":"src:file:1d3492df6545951dc5f17b5f","type":"repository_file"},{"digest":"sha256:a3dbd12b65109723933a01c2fdb1a6672d9b3f03b54cec2fbbd2e34e43554866","locator":"docs/packaging/P6_CONSUMER_MIGRATION_STATUS.json","source_id":"src:file:402c0b0e7f4cc51891eba2c5","type":"repository_file"},{"digest":"sha256:216f355d57982eca18a2efe797236a1d3ff0ebbe3e9bb3fbaed2a80c6e6583ce","locator":"docs/packaging/P7_UPDATE_PROOF.md","source_id":"src:file:fc43fa0da4bfa4b2bfb32770","type":"repository_file"},{"digest":"sha256:ea080d7c143e3fd30ff353802125c5c76d5ded61f37e0160d7c5f3e32574e909","locator":"docs/packaging/P8_RELEASE_BASELINE.md","source_id":"src:file:55bf158b80e290f52e5549ea","type":"repository_file"},{"digest":"sha256:9ae9bfab2625b8037fd71057d84a3730c4b6746efa780a40ff1bb64ef2e85d6e","locator":"docs/packaging/P8_RELEASE_STATUS.json","source_id":"src:file:a797fb8fef72198ba1e818de","type":"repository_file"},{"digest":"sha256:f3e45d585f830b902c81989c5a14da368b3c6af648d18fd60a686bc0b9050302","locator":"docs/proposals/install-package/01-engineer-proposal.md","source_id":"src:file:690a3cef84a0f5dc402a6ac5","type":"repository_file"},{"digest":"sha256:fc5a8583e2313ce27cb237924acf13e5a00cc76a6517b6567932fb4e1b1c3661","locator":"docs/proposals/install-package/02-engineer-review.md","source_id":"src:file:3fd61d04c0ef06d4dd5d9e2a","type":"repository_file"},{"digest":"sha256:a8a77ed82c5c1972ce5422823c0e3dfce2d5d600556b01d596e37d05e38fa12b","locator":"docs/proposals/install-package/03-architect-review.md","source_id":"src:file:e80e47cc1903190c4e580437","type":"repository_file"},{"digest":"sha256:f979585f26816df8704c71b813d16912846b48aa70f79128b67d11b02480a45c","locator":"docs/proposals/install-package/FINAL_PLAN.md","source_id":"src:file:e0f07ad7a3eba2bfeb25d23d","type":"repository_file"}],"invocation_id":"repository-wide-v1-03-docs-packaging-proposals-20260820","output":{"raw_candidate_path":"project-knowledge/invocations/repository-wide-v1-03-docs-packaging-proposals-20260820.raw.json","submission_path":"project-knowledge/submissions/repository-wide-v1-03-docs-packaging-proposals-20260820.json"},"project_root":".","source_context":{"refs":["repository:8ce7e745f017d20ef90af043519c7379736dbc9d","partition:03-docs-packaging-proposals","scan:repository-wide-v1"],"summary":"First comprehensive repository distillation partition 03-docs-packaging-proposals; fixed repository snapshot 8ce7e745f017d20ef90af043519c7379736dbc9d."},"source_registry":[{"digest":"sha256:7a25162999213b953b39c89c2897f184bde732b250165da5131e6ceb8d68ca0d","locator":"docs/packaging/CURRENT_RELEASE_STATUS.json","source_id":"src:file:ebec2bc24e2262a606a6740e","type":"repository_file"},{"digest":"sha256:d341e8963b331dc0c0acf6bf8067a132151043c725638a3fb122513f1bb9c4f2","locator":"docs/packaging/INSTALLER_RUNNER_CONTRACT.md","source_id":"src:governed:db91826a5f0edf7f223e95d2","type":"governed_artifact"},{"digest":"sha256:7d4a4ab7f6985ad8b884ac49854598d257affa2bb51a85f19f8881b59ae10f2e","locator":"docs/packaging/INSTALL_PACKAGE_CONTRACT.md","source_id":"src:governed:1fba971e51c885f07559dd4d","type":"governed_artifact"},{"digest":"sha256:f24422e6abcf14b131545e4459ca31b468cd075ba9d913c412e33af2e38a5c24","locator":"docs/packaging/P1_DETERMINISTIC_INSTALLER_AMENDMENT.md","source_id":"src:file:310fadfa923e9f953b0f3bb0","type":"repository_file"},{"digest":"sha256:6cc8e9f979bf19f98e0e4a20f6c808b0727d961de2d09f4661c1a2934c3de75e","locator":"docs/packaging/P2_DETERMINISTIC_BUILDER.md","source_id":"src:file:d329db5ffdd538903f907dd8","type":"repository_file"},{"digest":"sha256:20e80a5869444c8b4f204993beda29e6e8bde3011a2ea430cc8d8355bc4e3c22","locator":"docs/packaging/P3_DETERMINISTIC_INSTALLER.md","source_id":"src:file:eada58fbbaf5254da03b8202","type":"repository_file"},{"digest":"sha256:d1485fec6b54676716a575d3b36d6c1e5560f6b017078456bb9e66d3bafb8895","locator":"docs/packaging/P4_JOURNALED_RECOVERY.md","source_id":"src:file:819ef41273a8c7b6eeb9a697","type":"repository_file"},{"digest":"sha256:a3c5cc4aaa76c74891f6fd41eda6e54752267608925851e2ec3b591147f8dd6f","locator":"docs/packaging/P5_RUNTIME_ISOLATION.md","source_id":"src:file:81ba86e43ea6a5eba2d6832d","type":"repository_file"},{"digest":"sha256:d72f8be27bb033bf934643a9f5fbde11898d50e6b34ce220e38329a1b96cecb9","locator":"docs/packaging/P5_RUNTIME_ISOLATION_STATUS.json","source_id":"src:file:d97bec4f39fa27335bc4a5be","type":"repository_file"},{"digest":"sha256:0d64f35bd3a41d1d8180640759986e416aa986a6445656959661a78e04d4bd75","locator":"docs/packaging/P6_CONSUMER_MIGRATION.md","source_id":"src:file:1d3492df6545951dc5f17b5f","type":"repository_file"},{"digest":"sha256:a3dbd12b65109723933a01c2fdb1a6672d9b3f03b54cec2fbbd2e34e43554866","locator":"docs/packaging/P6_CONSUMER_MIGRATION_STATUS.json","source_id":"src:file:402c0b0e7f4cc51891eba2c5","type":"repository_file"},{"digest":"sha256:216f355d57982eca18a2efe797236a1d3ff0ebbe3e9bb3fbaed2a80c6e6583ce","locator":"docs/packaging/P7_UPDATE_PROOF.md","source_id":"src:file:fc43fa0da4bfa4b2bfb32770","type":"repository_file"},{"digest":"sha256:ea080d7c143e3fd30ff353802125c5c76d5ded61f37e0160d7c5f3e32574e909","locator":"docs/packaging/P8_RELEASE_BASELINE.md","source_id":"src:file:55bf158b80e290f52e5549ea","type":"repository_file"},{"digest":"sha256:9ae9bfab2625b8037fd71057d84a3730c4b6746efa780a40ff1bb64ef2e85d6e","locator":"docs/packaging/P8_RELEASE_STATUS.json","source_id":"src:file:a797fb8fef72198ba1e818de","type":"repository_file"},{"digest":"sha256:f3e45d585f830b902c81989c5a14da368b3c6af648d18fd60a686bc0b9050302","locator":"docs/proposals/install-package/01-engineer-proposal.md","source_id":"src:file:690a3cef84a0f5dc402a6ac5","type":"repository_file"},{"digest":"sha256:fc5a8583e2313ce27cb237924acf13e5a00cc76a6517b6567932fb4e1b1c3661","locator":"docs/proposals/install-package/02-engineer-review.md","source_id":"src:file:3fd61d04c0ef06d4dd5d9e2a","type":"repository_file"},{"digest":"sha256:a8a77ed82c5c1972ce5422823c0e3dfce2d5d600556b01d596e37d05e38fa12b","locator":"docs/proposals/install-package/03-architect-review.md","source_id":"src:file:e80e47cc1903190c4e580437","type":"repository_file"},{"digest":"sha256:f979585f26816df8704c71b813d16912846b48aa70f79128b67d11b02480a45c","locator":"docs/proposals/install-package/FINAL_PLAN.md","source_id":"src:file:e0f07ad7a3eba2bfeb25d23d","type":"repository_file"}]}
