{"contract":"reasoning-distiller-invocation/1","created_at":"2026-08-20T18:49:44-07:00","evidence":[{"digest":"sha256:749a327e5866b87d6138bd279282783706cf5d495574e46c5e1a51dd05b84ff4","locator":"INSTALLING.md","source_id":"src:file:7ef4d964d956eac05e3d6cf0","type":"repository_file"},{"digest":"sha256:115a49439dfd58ed62cb810a9f0c013bcbdfdda20c3acfdcb95cabd5cccb0fdc","locator":"README.md","source_id":"src:file:b335630551682c19a781afeb","type":"repository_file"},{"digest":"sha256:8c88836d48d1a42b6b1df5bc070cc5925c8ee93e66f4dc86a3f082e3b2f59f9d","locator":"docs/extraction/CONSUMER_MIGRATION.md","source_id":"src:file:6af318ca4ffc22b51d86f19e","type":"repository_file"},{"digest":"sha256:d992ceb7a5cfd24990de39d9395e03063ab37528d7f8e66cb9a2b90fbbd46ee8","locator":"docs/extraction/baseline.json","source_id":"src:file:f8e742e458a4f4251f394c13","type":"repository_file"},{"digest":"sha256:27de86355fd6705a0ca54ba6d51a3608c5ad0508224ee86fe86ad8d0dd6394f5","locator":"docs/extraction/copied-artifacts.json","source_id":"src:file:6b4de536c1ae14243d290079","type":"repository_file"},{"digest":"sha256:d371a8e0118e9b38e726eaa77af649fc8c7970a01bcd2e4b45198318648d1a7e","locator":"docs/extraction/exact-copy-manifest.json","source_id":"src:file:ad9f192646fe12518e06ead5","type":"repository_file"},{"digest":"sha256:914705e4be7c5292dc47e1aef89019292268c0b2f367cb46c335bcb72a5c8f44","locator":"docs/extraction/phase6-baseline.json","source_id":"src:file:f94086985998f9a43e3cc29a","type":"repository_file"},{"digest":"sha256:13f6d67693be3f4d809f777bc6c399ad9654fa1d16dec0e6c51e241a82bf44bc","locator":"docs/extraction/phase6-consumer-migration.json","source_id":"src:file:bc797703ce7627a7ad802d3f","type":"repository_file"},{"digest":"sha256:24c483f2fdb231f72f795b1bb1f1a5f808aead492215a70cef0f2e88eb0f977f","locator":"docs/extraction/phase6-parity-report.json","source_id":"src:file:b476c680f4425aaafee619eb","type":"repository_file"},{"digest":"sha256:eed88ebd475b6b58529f7e37b7dae2d4e437c4f4b55bd686c0896e58c6c77d3d","locator":"docs/extraction/reference-proof-copy-manifest.json","source_id":"src:file:7c2ca19d2806bd742fdbf23e","type":"repository_file"},{"digest":"sha256:0ec875c96b35d19c663e8df669e779e5b7faee9e4449c6a73f8c24a3f36b40e6","locator":"docs/extraction/run-parity-request.txt","source_id":"src:file:d1337453d8097eb711a846ea","type":"repository_file"},{"digest":"sha256:cb92277ea4e9b2316b7354a2dcc9f9022834ab356c738b0141ff0f62703b08fd","locator":"docs/extraction/run-reference-proof-copy.txt","source_id":"src:file:f1ee16c7690954e4858b88b8","type":"repository_file"},{"digest":"sha256:16b40e67a88c2398fb91cf66dfdd7ccbb62288564067a87cd5c2b344b09b3747","locator":"docs/governance/PROPOSAL_REVIEW_METHOD.md","source_id":"src:file:b347ef5c52219176d886f8c3","type":"repository_file"},{"digest":"sha256:5a9382e9bdd39f97b0194b77ff78cc59da52b6359a452064a507a1dd65d19270","locator":"docs/testing/CONSUMER_TRIALS.md","source_id":"src:file:44600b3747b4a8020d8e5da7","type":"repository_file"},{"digest":"sha256:38642a91d4280d75e7ea3fc82ea9944e5ac300fb90c84b63fbdb5c39678b2cfb","locator":"docs/testing/GREENFIELD_CONSUMER_TRIAL.md","source_id":"src:file:3b709a707e3095d9836905ab","type":"repository_file"},{"digest":"sha256:c3f46e7ab4b32f463fb99de3722cde8ddd0456f7b7469971b265cba1bad53b73","locator":"docs/testing/GREENFIELD_FIRST_INVOCATION_TRIAL.md","source_id":"src:file:49cdcbc0039b528294d6abd4","type":"repository_file"},{"digest":"sha256:5b017fb6e8aa598fb679130983c4c085bd3a86b2a56800287ca72502aad35691","locator":"docs/testing/LIVE_MODEL_ACTIVATION_TRIAL.md","source_id":"src:file:d7b3b596455efe0a21a1e4aa","type":"repository_file"},{"digest":"sha256:1df7754b1376e7e96e54b703e7bc6bdcc1332126d7e2b2db3af5e420c9fc10a5","locator":"docs/testing/SELF_CONSUMPTION_ISOLATION.md","source_id":"src:file:041610ba2b2d10f935292048","type":"repository_file"},{"digest":"sha256:427813603c80d803bc0686c906f30457dde21acb7cca26a0c5e97f900146a0df","locator":"docs/testing/STEWARD_HANDOFF_RECONCILIATION_TRIAL.md","source_id":"src:file:4e2a7865cf82fdd802da31ab","type":"repository_file"},{"digest":"sha256:7d112252ffc93e5173981a19bcac3320256db0a3d8c35141a4b4ca7b4ef47190","locator":"docs/testing/evidence/live-model-activation-1.raw.json","source_id":"src:file:ed5c8add9f9c081cd3f62181","type":"repository_file"}],"invocation_id":"repository-wide-v1-04-docs-other-root-20260820","output":{"raw_candidate_path":"project-knowledge/invocations/repository-wide-v1-04-docs-other-root-20260820.raw.json","submission_path":"project-knowledge/submissions/repository-wide-v1-04-docs-other-root-20260820.json"},"project_root":".","source_context":{"refs":["repository:8ce7e745f017d20ef90af043519c7379736dbc9d","partition:04-docs-other-root","scan:repository-wide-v1"],"summary":"First comprehensive repository distillation partition 04-docs-other-root; fixed repository snapshot 8ce7e745f017d20ef90af043519c7379736dbc9d."},"source_registry":[{"digest":"sha256:749a327e5866b87d6138bd279282783706cf5d495574e46c5e1a51dd05b84ff4","locator":"INSTALLING.md","source_id":"src:file:7ef4d964d956eac05e3d6cf0","type":"repository_file"},{"digest":"sha256:115a49439dfd58ed62cb810a9f0c013bcbdfdda20c3acfdcb95cabd5cccb0fdc","locator":"README.md","source_id":"src:file:b335630551682c19a781afeb","type":"repository_file"},{"digest":"sha256:8c88836d48d1a42b6b1df5bc070cc5925c8ee93e66f4dc86a3f082e3b2f59f9d","locator":"docs/extraction/CONSUMER_MIGRATION.md","source_id":"src:file:6af318ca4ffc22b51d86f19e","type":"repository_file"},{"digest":"sha256:d992ceb7a5cfd24990de39d9395e03063ab37528d7f8e66cb9a2b90fbbd46ee8","locator":"docs/extraction/baseline.json","source_id":"src:file:f8e742e458a4f4251f394c13","type":"repository_file"},{"digest":"sha256:27de86355fd6705a0ca54ba6d51a3608c5ad0508224ee86fe86ad8d0dd6394f5","locator":"docs/extraction/copied-artifacts.json","source_id":"src:file:6b4de536c1ae14243d290079","type":"repository_file"},{"digest":"sha256:d371a8e0118e9b38e726eaa77af649fc8c7970a01bcd2e4b45198318648d1a7e","locator":"docs/extraction/exact-copy-manifest.json","source_id":"src:file:ad9f192646fe12518e06ead5","type":"repository_file"},{"digest":"sha256:914705e4be7c5292dc47e1aef89019292268c0b2f367cb46c335bcb72a5c8f44","locator":"docs/extraction/phase6-baseline.json","source_id":"src:file:f94086985998f9a43e3cc29a","type":"repository_file"},{"digest":"sha256:13f6d67693be3f4d809f777bc6c399ad9654fa1d16dec0e6c51e241a82bf44bc","locator":"docs/extraction/phase6-consumer-migration.json","source_id":"src:file:bc797703ce7627a7ad802d3f","type":"repository_file"},{"digest":"sha256:24c483f2fdb231f72f795b1bb1f1a5f808aead492215a70cef0f2e88eb0f977f","locator":"docs/extraction/phase6-parity-report.json","source_id":"src:file:b476c680f4425aaafee619eb","type":"repository_file"},{"digest":"sha256:eed88ebd475b6b58529f7e37b7dae2d4e437c4f4b55bd686c0896e58c6c77d3d","locator":"docs/extraction/reference-proof-copy-manifest.json","source_id":"src:file:7c2ca19d2806bd742fdbf23e","type":"repository_file"},{"digest":"sha256:0ec875c96b35d19c663e8df669e779e5b7faee9e4449c6a73f8c24a3f36b40e6","locator":"docs/extraction/run-parity-request.txt","source_id":"src:file:d1337453d8097eb711a846ea","type":"repository_file"},{"digest":"sha256:cb92277ea4e9b2316b7354a2dcc9f9022834ab356c738b0141ff0f62703b08fd","locator":"docs/extraction/run-reference-proof-copy.txt","source_id":"src:file:f1ee16c7690954e4858b88b8","type":"repository_file"},{"digest":"sha256:16b40e67a88c2398fb91cf66dfdd7ccbb62288564067a87cd5c2b344b09b3747","locator":"docs/governance/PROPOSAL_REVIEW_METHOD.md","source_id":"src:file:b347ef5c52219176d886f8c3","type":"repository_file"},{"digest":"sha256:5a9382e9bdd39f97b0194b77ff78cc59da52b6359a452064a507a1dd65d19270","locator":"docs/testing/CONSUMER_TRIALS.md","source_id":"src:file:44600b3747b4a8020d8e5da7","type":"repository_file"},{"digest":"sha256:38642a91d4280d75e7ea3fc82ea9944e5ac300fb90c84b63fbdb5c39678b2cfb","locator":"docs/testing/GREENFIELD_CONSUMER_TRIAL.md","source_id":"src:file:3b709a707e3095d9836905ab","type":"repository_file"},{"digest":"sha256:c3f46e7ab4b32f463fb99de3722cde8ddd0456f7b7469971b265cba1bad53b73","locator":"docs/testing/GREENFIELD_FIRST_INVOCATION_TRIAL.md","source_id":"src:file:49cdcbc0039b528294d6abd4","type":"repository_file"},{"digest":"sha256:5b017fb6e8aa598fb679130983c4c085bd3a86b2a56800287ca72502aad35691","locator":"docs/testing/LIVE_MODEL_ACTIVATION_TRIAL.md","source_id":"src:file:d7b3b596455efe0a21a1e4aa","type":"repository_file"},{"digest":"sha256:1df7754b1376e7e96e54b703e7bc6bdcc1332126d7e2b2db3af5e420c9fc10a5","locator":"docs/testing/SELF_CONSUMPTION_ISOLATION.md","source_id":"src:file:041610ba2b2d10f935292048","type":"repository_file"},{"digest":"sha256:427813603c80d803bc0686c906f30457dde21acb7cca26a0c5e97f900146a0df","locator":"docs/testing/STEWARD_HANDOFF_RECONCILIATION_TRIAL.md","source_id":"src:file:4e2a7865cf82fdd802da31ab","type":"repository_file"},{"digest":"sha256:7d112252ffc93e5173981a19bcac3320256db0a3d8c35141a4b4ca7b4ef47190","locator":"docs/testing/evidence/live-model-activation-1.raw.json","source_id":"src:file:ed5c8add9f9c081cd3f62181","type":"repository_file"}]}
