{"contract":"reasoning-distiller-invocation/1","created_at":"2026-08-20T10:44:00-07:00","evidence":[{"digest":"sha256:51c23c528d414e19441669b61cf4767839a40db699bcbcc7bf8810df6bd3ebde","locator":"docs/design/RIL_CLI_DESIGN_CONTRACT.md","source_id":"src:file:71d9162352d8107132c1f937","type":"repository_file"},{"digest":"sha256:f102645b8a6a341f95de7131197c3204f775bd3cace9a4d24ff7ad12bcba082d","locator":"docs/design/RIL_HUMAN_AGENT_DESIGN_CONTRACT.md","source_id":"src:file:77bdea8cdeb6f95186b56b60","type":"repository_file"},{"digest":"sha256:3873730f9667931e989d2f2225a12c13f811d0f4369de2dfccd32b77fb13bb88","locator":"docs/design/RIL_R16_R18_IMPLEMENTATION_CONFORMANCE_PLAN.md","source_id":"src:file:e556c36f56c6ce518fe49b23","type":"repository_file"},{"digest":"sha256:4a6518ab6e1e692207adea1a1238419437ecdca378a0d5a58e2816ad5f584dd2","locator":"docs/design/RIL_WORKFLOW_DESIGN_CONTRACT.md","source_id":"src:file:27e07171f4b52ff7c98a0c7f","type":"repository_file"},{"digest":"sha256:d341e8963b331dc0c0acf6bf8067a132151043c725638a3fb122513f1bb9c4f2","locator":"docs/packaging/INSTALLER_RUNNER_CONTRACT.md","source_id":"src:file:db91826a5f0edf7f223e95d2","type":"repository_file"},{"digest":"sha256:7d4a4ab7f6985ad8b884ac49854598d257affa2bb51a85f19f8881b59ae10f2e","locator":"docs/packaging/INSTALL_PACKAGE_CONTRACT.md","source_id":"src:file:1fba971e51c885f07559dd4d","type":"repository_file"},{"digest":"sha256:20e80a5869444c8b4f204993beda29e6e8bde3011a2ea430cc8d8355bc4e3c22","locator":"docs/packaging/P3_DETERMINISTIC_INSTALLER.md","source_id":"src:file:eada58fbbaf5254da03b8202","type":"repository_file"},{"digest":"sha256:ea080d7c143e3fd30ff353802125c5c76d5ded61f37e0160d7c5f3e32574e909","locator":"docs/packaging/P8_RELEASE_BASELINE.md","source_id":"src:file:55bf158b80e290f52e5549ea","type":"repository_file"}],"invocation_id":"first-normative-baseline-20260820","output":{"raw_candidate_path":"project-knowledge/invocations/first-normative-baseline-20260820.raw.json","submission_path":"project-knowledge/submissions/first-normative-baseline-20260820.json"},"project_root":".","source_context":{"refs":["baseline:first-distillation"],"summary":"First curated normative baseline for Reasoning Distiller"},"source_registry":[{"digest":"sha256:51c23c528d414e19441669b61cf4767839a40db699bcbcc7bf8810df6bd3ebde","locator":"docs/design/RIL_CLI_DESIGN_CONTRACT.md","source_id":"src:file:71d9162352d8107132c1f937","type":"repository_file"},{"digest":"sha256:f102645b8a6a341f95de7131197c3204f775bd3cace9a4d24ff7ad12bcba082d","locator":"docs/design/RIL_HUMAN_AGENT_DESIGN_CONTRACT.md","source_id":"src:file:77bdea8cdeb6f95186b56b60","type":"repository_file"},{"digest":"sha256:3873730f9667931e989d2f2225a12c13f811d0f4369de2dfccd32b77fb13bb88","locator":"docs/design/RIL_R16_R18_IMPLEMENTATION_CONFORMANCE_PLAN.md","source_id":"src:file:e556c36f56c6ce518fe49b23","type":"repository_file"},{"digest":"sha256:4a6518ab6e1e692207adea1a1238419437ecdca378a0d5a58e2816ad5f584dd2","locator":"docs/design/RIL_WORKFLOW_DESIGN_CONTRACT.md","source_id":"src:file:27e07171f4b52ff7c98a0c7f","type":"repository_file"},{"digest":"sha256:d341e8963b331dc0c0acf6bf8067a132151043c725638a3fb122513f1bb9c4f2","locator":"docs/packaging/INSTALLER_RUNNER_CONTRACT.md","source_id":"src:file:db91826a5f0edf7f223e95d2","type":"repository_file"},{"digest":"sha256:7d4a4ab7f6985ad8b884ac49854598d257affa2bb51a85f19f8881b59ae10f2e","locator":"docs/packaging/INSTALL_PACKAGE_CONTRACT.md","source_id":"src:file:1fba971e51c885f07559dd4d","type":"repository_file"},{"digest":"sha256:20e80a5869444c8b4f204993beda29e6e8bde3011a2ea430cc8d8355bc4e3c22","locator":"docs/packaging/P3_DETERMINISTIC_INSTALLER.md","source_id":"src:file:eada58fbbaf5254da03b8202","type":"repository_file"},{"digest":"sha256:ea080d7c143e3fd30ff353802125c5c76d5ded61f37e0160d7c5f3e32574e909","locator":"docs/packaging/P8_RELEASE_BASELINE.md","source_id":"src:file:55bf158b80e290f52e5549ea","type":"repository_file"}]}
